DOWNLOAD PAGE,,,,,,,,,,,,,,
English,French,Dutch,German,Spanish,Portuguese,Polish,Arabic,Italian,Malay,Chinese ,Urdu (Pakistan),Indonesian,Vietnamese,Thai
A new alternative to your crypto journey,Une nouvelle alternative à votre parcours crypto,Een nieuw alternatief voor uw crypto-reis,Eine neue Alternative für Ihre Kryptoreise,Una nueva alternativa para tu viaje con las criptomonedas,Uma nova alternativa para sua jornada com criptomoedas,Nowa alternatywa dla Twojej podróży kryptowalutowej,بديل جديد لرحلتك في عالم العملات المشفرة,Una nuova alternativa al tuo viaggio nel mondo delle criptovalute,Alternatif baharu untuk perjalanan crypto anda,您的加密之旅的新选择,آپ کے کرپٹو سفر کا ایک نیا متبادل,Alternatif baru untuk perjalanan kripto Anda,Một lựa chọn thay thế mới cho hành trình tiền điện tử của bạn,ทางเลือกใหม่ในการเดินทางสู่โลกคริปโตของคุณ
Crypto trading — made easy for you,Le trading de crypto-monnaies — simplifié pour vous,Cryptohandel – gemakkelijk gemaakt voor u,Krypto-Handel – leicht gemacht,Comercio de criptomonedas: simplificado para usted,Negociação de criptomoedas — facilitada para você,Handel kryptowalutami — ułatwiony dla Ciebie,تداول العملات المشفرة - أصبح سهلاً بالنسبة لك,Trading di criptovalute: reso facile per te,Perdagangan kripto — dipermudahkan untuk anda,加密货币交易 — 让您轻松便捷,کرپٹو ٹریڈنگ — آپ کے لیے آسان بنایا گیا ہے۔,Perdagangan kripto — dipermudah untuk Anda,Giao dịch tiền điện tử — dễ dàng cho bạn,การซื้อขาย Crypto — ทำได้ง่ายสำหรับคุณ
Powerful platform,Plateforme puissante,Krachtig platform,Leistungsstarke Plattform,Plataforma potente,Plataforma poderosa,Potężna platforma,منصة قوية,Piattaforma potente,Platform yang berkuasa,强大的平台,طاقتور پلیٹ فارم,Platform yang kuat,Nền tảng mạnh mẽ,แพลตฟอร์มอันทรงพลัง
One app,Une application,Eén app,Une-Anwendung,Una aplicación,Um aplicativo,Jedna aplikacja,تطبيق واحد,Un'app,Satu aplikasi,一个应用程序,ایک ایپ,Satu aplikasi,Một ứng dụng,แอปหนึ่ง
Download app,Télécharger l'application,App downloaden,Laden Sie die Anwendung herunter,Descargar aplicación,Baixar aplicativo,Pobierz aplikację,تنزيل التطبيق,Scarica l'app,Muat turun aplikasi,下载应用程序,ایپ ڈاؤن لوڈ کریں۔,Unduh aplikasi,Tải ứng dụng,ดาวน์โหลดแอป
Unlimited possibilities,Des possibilités illimitées,Onbeperkte mogelijkheden,Unbegrenzte Möglichkeiten,Posibilidades ilimitadas,Possibilidades ilimitadas,Nieograniczone możliwości,إمكانيات غير محدودة,Possibilità illimitate,Kemungkinan yang tidak terhad,无限可能,لامحدود امکانات,Kemungkinan tak terbatas,Khả năng vô hạn,ความเป็นไปได้ไม่จำกัด
Trade like a pro,Tradez comme un pro,Handel als een professional,Handeln Sie wie ein Profi,Opere como un profesional,Negocie como um profissional,Handluj jak profesjonalista,التجارة مثل المحترفين,Fai trading come un professionista,Berdagang seperti pro,像专业人士一样交易,ایک پرو کی طرح تجارت کریں۔,Berdagang seperti seorang profesional,Giao dịch như một chuyên gia,เทรดเหมือนมืออาชีพ
KINE app,Application KINE,KINE-app,Anwendungsfluss,Aplicación KINE,Aplicativo KINE,Aplikacja KINE,تطبيق KINE,Applicazione KINE,Apl fluks,KINE 应用程序,فلکس ایپ,Aplikasi KINE,Ứng dụng KINE,แอปฟลักซ์
Crypto exchange on the go,Échange de crypto-monnaies en déplacement,Crypto-uitwisseling onderweg,Krypto-Monats-Wechsel und -Verschiebung,Intercambio de criptomonedas en movimiento,Troca de criptomoedas em movimento,Giełda kryptowalut w podróży,تبادل العملات المشفرة أثناء التنقل,Scambio di criptovalute in movimento,Pertukaran kripto semasa dalam perjalanan,随时随地进行加密货币交易,چلتے پھرتے کرپٹو ایکسچینج,Pertukaran kripto saat bepergian,Trao đổi tiền điện tử khi đang di chuyển,การแลกเปลี่ยน Crypto ขณะเดินทาง
Download Desktop,Télécharger Desktop,Bureaublad downloaden,Desktop herunterladen,Descargar escritorio,Baixar Desktop,Pobierz wersję na komputer,تنزيل سطح المكتب,Scarica Desktop,Muat turun Desktop,下载桌面版,ڈیسک ٹاپ ڈاؤن لوڈ کریں۔,Unduh Desktop,Tải xuống máy tính để bàn,ดาวน์โหลดเดสก์ท็อป
©2025 Kinecoin.co | All Rights Reserved,©2025 Kinecoin.co | Tous droits réservés,©2025 Kinecoin.co | Alle rechten voorbehouden,©2025 Kinecoin.co | Tous droits réservés,©2025 Kinecoin.co | Todos los derechos reservados,©2025 Kinecoin.co | Todos os direitos reservados,©2025 Kinecoin.co | Wszelkie prawa zastrzeżone,©2025 Kinecoin.co | جميع الحقوق محفوظة,©2025 Kinecoin.co | Tutti i diritti riservati,©2025 Kinecoin.co | Hak Cipta Terpelihara,©2025 Kinecoin.co | 版权所有,©2025 Kinecoin.co | جملہ حقوق محفوظ ہیں۔,©2025 Kinecoin.co | Hak Cipta Dilindungi Undang-Undang,©2025 Kinecoin.co | Mọi quyền được bảo lưu,©2025 Kinecoin.co | สงวนลิขสิทธิ์
More about KINE,En savoir plus sur KINE,Meer over KINE,Mehr erfahren über KINE,Más sobre KINE,Mais sobre KINE,Więcej o KINE,المزيد عن KINE,Maggiori informazioni su KINE,Lebih lanjut mengenai KINE,关于 KINE 的更多信息,KINE کے بارے میں مزید,Lebih lanjut tentang KINE,Tìm hiểu thêm về KINE,ข้อมูลเพิ่มเติมเกี่ยวกับ KINE
About us,À propos de nous,Over ons,Über uns,Sobre nosotros,Sobre nós,O nas,معلومات عنا,Chi siamo,Tentang kami,关于我们,ہمارے بارے میں,Tentang kami,Về chúng tôi,เกี่ยวกับเรา
Terms of Use,Conditions d'utilisation,Gebruiksvoorwaarden,Nutzungsbedingungen,Condiciones de uso,Termos de Uso,Warunki korzystania,شروط الاستخدام,Termini di utilizzo,Syarat Penggunaan,使用条款,استعمال کی شرائط,Ketentuan Penggunaan,Điều khoản sử dụng,เงื่อนไขการใช้งาน
Privacy and Cookie Policy,Politique de confidentialité et de cookies,Privacy- en cookiebeleid,Datenschutz und Cookies,Política de privacidad y cookies,Política de Privacidade e Cookies,Polityka prywatności i plików cookie,سياسة الخصوصية وملفات تعريف الارتباط,Informativa sulla privacy e sui cookie,Dasar Privasi dan Kuki,隐私和 Cookie 政策,رازداری اور کوکی پالیسی,Kebijakan Privasi dan Cookie,Chính sách bảo mật và cookie,นโยบายความเป็นส่วนตัวและคุกกี้
Download App,Télécharger l'application,App downloaden,Laden Sie die Anwendung herunter,Descargar la aplicación,Baixar aplicativo,Pobierz aplikację,تنزيل التطبيق,Scarica l'app,Muat turun Apl,下载应用程序,ایپ ڈاؤن لوڈ کریں۔,Unduh Aplikasi,Tải ứng dụng,ดาวน์โหลดแอป
Products,Produits,Producten,Produkte,Productos,Produtos,Produkty,منتجات,Prodotti,Produk,产品,مصنوعات,Produk,Các sản phẩm,สินค้า
Spot Trading,Négociation au comptant,Spothandel,Verhandlung mit dem Kunden,Comercio al contado,Negociação à vista,Handel spotowy,التداول الفوري,Negoziazione spot,Dagangan Spot,现货交易,سپاٹ ٹریڈنگ,Perdagangan Spot,Giao dịch giao ngay,การซื้อขายแบบสปอต
Futures Trading,Négociation à terme,Futureshandel,Vertragsverhandlungen,Comercio de futuros,Negociação de Futuros,Handel kontraktami terminowymi,تداول العقود الآجلة,Negoziazione di futures,Dagangan Niaga Hadapan,期货交易,فیوچر ٹریڈنگ,Perdagangan Berjangka,Giao dịch tương lai,การซื้อขายล่วงหน้า
Conversion,Conversion,Conversie,Konvertierung,Conversión,Conversão,Konwersja,تحويل,Conversione,Penukaran,转换,تبدیلی,Konversi,Chuyển đổi,การแปลง
Earn,Gagner,Verdienen,Gagner,Ganar,Ganhar,Zarabiać,يكسب,Guadagnare,Dapatkan,赚,کمائیں,Menghasilkan,Kiếm,ได้รับ
Markets,Marchés,Markten,Märkte,Mercados,Mercados,Rynki,الأسواق,Mercati,Pasaran,市场,منڈیاں,Pasar,Thị trường,ตลาด
Market Overview,Aperçu du marché,Marktoverzicht,Marktübersicht,Descripción general del mercado,Visão geral do mercado,Przegląd rynku,نظرة عامة على السوق,Panoramica del mercato,Tinjauan Pasaran,市场概览,مارکیٹ کا جائزہ,Gambaran Umum Pasar,Tổng quan thị trường,ภาพรวมตลาด
Assets,Actifs,Activa,Actifs,Activos,Ativos,Aktywa,أصول,Attività,Aset,资产,اثاثے,Aktiva,Tài sản,สินทรัพย์
Account,Compte,Rekening,Konto,Cuenta,Conta,Konto,حساب,Account,Akaun,帐户,اکاؤنٹ,Akun,Tài khoản,บัญชี
Sign Up,S'inscrire,Aanmelden,Registrieren,Inscribirse,Inscrever-se,Zapisać się,اشتراك,Iscrizione,Daftar,报名,سائن اپ کریں۔,Mendaftar,Đăng ký,สมัครสมาชิก
Login,Se connecter,Login,Anmelden,Acceso,Conecte-se,Login,تسجيل الدخول,Login,Log masuk,登录,لاگ ان,Login,Đăng nhập,เข้าสู่ระบบ
Resources,Ressources,Bronnen,Ressourcen,Recursos,Recursos,Zasoby,موارد,Risorse,Sumber,资源,وسائل,Sumber daya,Tài nguyên,ทรัพยากร
About Us,À propos de nous,Over ons,Über uns,Sobre nosotros,Sobre nós,O nas,معلومات عنا,Chi siamo,Tentang Kami,关于我们,ہمارے بارے میں,Tentang Kami,Giới thiệu về chúng tôi,เกี่ยวกับเรา
Download App,Télécharger l'application,App downloaden,Laden Sie die Anwendung herunter,Descargar la aplicación,Baixar aplicativo,Pobierz aplikację,تنزيل التطبيق,Scarica l'app,Muat turun Apl,下载应用程序,ایپ ڈاؤن لوڈ کریں۔,Unduh Aplikasi,Tải ứng dụng,ดาวน์โหลดแอป
Trade,Commerce,Handel,Handel,Comercio,Troca,Handel,تجارة,Commercio,Berdagang,贸易,تجارت,Berdagang,Buôn bán,ซื้อขาย
Spot Trading,Négociation au comptant,Spothandel,Verhandlung mit dem Kunden,Comercio al contado,Negociação à vista,Handel spotowy,التداول الفوري,Negoziazione spot,Dagangan Spot,现货交易,سپاٹ ٹریڈنگ,Perdagangan Spot,Giao dịch giao ngay,การซื้อขายแบบสปอต
Futures Trading,Négociation à terme,Futureshandel,Vertragsverhandlungen,Comercio de futuros,Negociação de Futuros,Handel kontraktami terminowymi,تداول العقود الآجلة,Negoziazione di futures,Dagangan Niaga Hadapan,期货交易,فیوچر ٹریڈنگ,Perdagangan Berjangka,Giao dịch tương lai,การซื้อขายล่วงหน้า
Trade on the go with KINE,Tradez en déplacement avec KINE,Handel onderweg met KINE,Handel und Vertrieb mit KINE,Opere sobre la marcha con KINE,Negocie em qualquer lugar com a KINE,Handluj w podróży z KINE,التداول أثناء التنقل مع KINE,Fai trading in mobilità con KINE,Berdagang semasa dalam perjalanan dengan KINE,使用 KINE 随时随地进行交易,KINE کے ساتھ چلتے پھرتے تجارت کریں۔,Berdagang saat bepergian dengan KINE,Giao dịch khi đang di chuyển với KINE,ซื้อขายได้ทุกที่ด้วย KINE
Scan to download KINE app,Scannez pour télécharger l'application KINE,Scan om de KINE-app te downloaden,"Scannen Sie, um die KINE-Anwendung herunterzuladen",Escanee para descargar la aplicación KINE,Escaneie para baixar o aplicativo KINE,"Zeskanuj, aby pobrać aplikację KINE",امسح ضوئيًا لتنزيل تطبيق KINE,Scansiona per scaricare l'app KINE,Imbas untuk memuat turun aplikasi KINE,扫描下载FLUX App,KINE ایپ ڈاؤن لوڈ کرنے کے لیے اسکین کریں۔,Pindai untuk mengunduh aplikasi KINE,Quét để tải xuống ứng dụng KINE,สแกนเพื่อดาวน์โหลดแอป KINE
,,,,,,,,,,,,,,
,,,,,,,,,,,,,,
ABOUT PAGE,,,,,,,,,,,,,,
About KINE,À propos de KINE,Over KINE,Über KINE,Acerca de KINE,Sobre a KINE,O KINE,حول KINE,Informazioni su KINE,Mengenai KINE,关于 KINE,KINE کے بارے میں,Tentang KINE,Giới thiệu về KINE,เกี่ยวกับฟลักซ์
Your trusted partner in the world of cryptocurrency trading and investment,Votre partenaire de confiance dans le monde du trading et de l'investissement en cryptomonnaies,Uw vertrouwde partner in de wereld van cryptocurrency-handel en -investeringen,Ihr vertrauenswürdiger Partner in der Welt des Kryptowährungshandels und -investments,Su socio de confianza en el mundo del comercio y la inversión en criptomonedas,Seu parceiro de confiança no mundo do investimento e negociação de criptomoedas,Twój zaufany partner w świecie handlu i inwestycji w kryptowaluty,شريكك الموثوق في عالم تداول واستثمار العملات المشفرة,Il tuo partner di fiducia nel mondo del trading e degli investimenti in criptovalute,Rakan kongsi anda yang dipercayai dalam dunia perdagangan dan pelaburan mata wang kripto,您在加密货币交易和投资领域值得信赖的合作伙伴,cryptocurrency ٹریڈنگ اور سرمایہ کاری کی دنیا میں آپ کا بھروسہ مند پارٹنر,Mitra tepercaya Anda di dunia perdagangan dan investasi mata uang kripto,Đối tác đáng tin cậy của bạn trong thế giới giao dịch và đầu tư tiền điện tử,พันธมิตรที่เชื่อถือได้ของคุณในโลกของการซื้อขายและการลงทุนสกุลเงินดิจิทัล
Our Mission,Notre mission,Onze missie,Unsere Mission,Nuestra misión,Nossa Missão,Nasza misja,مهمتنا,La nostra missione,Misi Kami,我们的使命,ہمارا مشن,Misi Kami,Sứ mệnh của chúng tôi,ภารกิจของเรา
"At KINE, we're on a mission to make cryptocurrency trading accessible, secure, and efficient for everyone. We believe in the transformative power of blockchain technology and digital assets to create a more inclusive and transparent financial system.","Chez KINE, notre mission est de rendre le trading de cryptomonnaies accessible, sécurisé et efficace pour tous. Nous croyons au pouvoir transformateur de la technologie blockchain et des actifs numériques pour créer un système financier plus inclusif et transparent.","Bij KINE hebben we als missie om cryptohandel toegankelijk, veilig en efficiënt te maken voor iedereen. Wij geloven in de transformerende kracht van blockchaintechnologie en digitale activa om een ​​inclusiever en transparanter financieel systeem te creëren.","Bei KINE haben wir es uns zur Aufgabe gemacht, den Handel mit Kryptowährungen für alle zugänglich, sicher und effizient zu machen. Wir glauben an die transformative Kraft der Blockchain-Technologie und digitaler Assets, um ein integrativeres und transparenteres Finanzsystem zu schaffen.","En KINE, nuestra misión es hacer que el trading de criptomonedas sea accesible, seguro y eficiente para todos. Creemos en el poder transformador de la tecnología blockchain y los activos digitales para crear un sistema financiero más inclusivo y transparente.","Na KINE, nossa missão é tornar a negociação de criptomoedas acessível, segura e eficiente para todos. Acreditamos no poder transformador da tecnologia blockchain e dos ativos digitais para criar um sistema financeiro mais inclusivo e transparente.","W KINE naszą misją jest zapewnienie każdemu dostępu do handlu kryptowalutami, bezpieczeństwa i efektywności. Wierzymy w transformacyjną moc technologii blockchain i cyfrowych aktywów, które mogą przyczynić się do stworzenia bardziej inkluzywnego i przejrzystego systemu finansowego.",في KINE، نسعى جاهدين لجعل تداول العملات المشفرة متاحًا وآمنًا وفعالًا للجميع. نؤمن بالقدرة التحويلية لتقنية البلوك تشين والأصول الرقمية في بناء نظام مالي أكثر شمولًا وشفافية.,"In KINE, la nostra missione è rendere il trading di criptovalute accessibile, sicuro ed efficiente per tutti. Crediamo nel potere trasformativo della tecnologia blockchain e degli asset digitali per creare un sistema finanziario più inclusivo e trasparente.","Di KINE, kami menjalankan misi untuk menjadikan perdagangan mata wang kripto boleh diakses, selamat dan cekap untuk semua orang. Kami percaya kepada kuasa transformatif teknologi blockchain dan aset digital untuk mewujudkan sistem kewangan yang lebih inklusif dan telus.",在 KINE，我们的使命是让每个人都能便捷、安全、高效地进行加密货币交易。我们坚信区块链技术和数字资产的变革力量，能够创造一个更具包容性和透明度的金融体系。,KINE میں، ہم کرپٹو کرنسی ٹریڈنگ کو ہر ایک کے لیے قابل رسائی، محفوظ اور موثر بنانے کے مشن پر ہیں۔ ہم ایک زیادہ جامع اور شفاف مالیاتی نظام بنانے کے لیے بلاک چین ٹیکنالوجی اور ڈیجیٹل اثاثوں کی تبدیلی کی طاقت پر یقین رکھتے ہیں۔,"Di KINE, kami memiliki misi untuk menjadikan perdagangan mata uang kripto mudah diakses, aman, dan efisien bagi semua orang. Kami percaya pada kekuatan transformatif teknologi blockchain dan aset digital untuk menciptakan sistem keuangan yang lebih inklusif dan transparan.","Tại KINE, chúng tôi đang thực hiện sứ mệnh giúp giao dịch tiền điện tử trở nên dễ tiếp cận, an toàn và hiệu quả cho mọi người. Chúng tôi tin vào sức mạnh chuyển đổi của công nghệ blockchain và tài sản kỹ thuật số để tạo ra một hệ thống tài chính toàn diện và minh bạch hơn.",ที่ KINE เรามุ่งมั่นที่จะทำให้การซื้อขายสกุลเงินดิจิทัลสามารถเข้าถึงได้ ปลอดภัย และมีประสิทธิภาพสำหรับทุกคน เราเชื่อมั่นในพลังแห่งการเปลี่ยนแปลงของเทคโนโลยีบล็อคเชนและสินทรัพย์ดิจิทัลเพื่อสร้างระบบการเงินที่ครอบคลุมและโปร่งใสมากขึ้น
"Our platform is designed with both beginners and experienced traders in mind, offering intuitive tools, educational resources, and advanced trading features to help you navigate the crypto market with confidence.","Notre plateforme est conçue pour les traders débutants et expérimentés, offrant des outils intuitifs, des ressources pédagogiques et des fonctionnalités de trading avancées pour vous aider à naviguer sur le marché des crypto-monnaies en toute confiance.","Ons platform is ontworpen met zowel beginners als ervaren handelaren in gedachten en biedt intuïtieve tools, educatieve bronnen en geavanceerde handelsfuncties waarmee u vol vertrouwen door de cryptomarkt kunt navigeren.","Unsere Plattform ist sowohl für Anfänger als auch für erfahrene Händler konzipiert und bietet intuitive Tools, Bildungsressourcen und erweiterte Handelsfunktionen, damit Sie sich sicher auf dem Kryptomarkt bewegen können.","Nuestra plataforma está diseñada teniendo en mente tanto a principiantes como a traders experimentados, ofreciendo herramientas intuitivas, recursos educativos y funciones comerciales avanzadas para ayudarlo a navegar por el mercado de criptomonedas con confianza.","Nossa plataforma foi projetada pensando tanto em traders iniciantes quanto experientes, oferecendo ferramentas intuitivas, recursos educacionais e recursos avançados de negociação para ajudar você a navegar no mercado de criptomoedas com confiança.","Nasza platforma została zaprojektowana z myślą zarówno o początkujących, jak i doświadczonych traderach. Oferuje intuicyjne narzędzia, materiały edukacyjne i zaawansowane funkcje handlowe, które pomogą Ci pewnie poruszać się po rynku kryptowalut.",تم تصميم منصتنا مع وضع المبتدئين والمتداولين ذوي الخبرة في الاعتبار، حيث توفر أدوات بديهية وموارد تعليمية وميزات تداول متقدمة لمساعدتك على التنقل في سوق العملات المشفرة بثقة.,"La nostra piattaforma è progettata pensando sia ai principianti che ai trader esperti, offrendo strumenti intuitivi, risorse formative e funzionalità di trading avanzate per aiutarti a navigare nel mercato delle criptovalute con sicurezza.","Platform kami direka bentuk dengan mengambil kira pemula dan pedagang berpengalaman, menawarkan alat intuitif, sumber pendidikan dan ciri dagangan lanjutan untuk membantu anda menavigasi pasaran crypto dengan yakin.",我们的平台在设计时充分考虑了初学者和经验丰富的交易者，提供直观的工具、教育资源和高级交易功能，帮助您自信地驾驭加密货币市场。,ہمارا پلیٹ فارم ابتدائی اور تجربہ کار تاجروں دونوں کو ذہن میں رکھتے ہوئے ڈیزائن کیا گیا ہے، جو بدیہی ٹولز، تعلیمی وسائل، اور جدید تجارتی خصوصیات پیش کرتا ہے تاکہ آپ کو اعتماد کے ساتھ کرپٹو مارکیٹ میں تشریف لے جانے میں مدد ملے۔,"Platform kami dirancang dengan mempertimbangkan pedagang pemula dan berpengalaman, menawarkan alat yang intuitif, sumber daya pendidikan, dan fitur perdagangan canggih untuk membantu Anda menavigasi pasar kripto dengan percaya diri.","Nền tảng của chúng tôi được thiết kế dành cho cả người mới bắt đầu và người giao dịch có kinh nghiệm, cung cấp các công cụ trực quan, tài nguyên giáo dục và các tính năng giao dịch nâng cao để giúp bạn điều hướng thị trường tiền điện tử một cách tự tin.",แพลตฟอร์มของเราได้รับการออกแบบมาโดยคำนึงถึงทั้งผู้เริ่มต้นและผู้ซื้อขายที่มีประสบการณ์ โดยนำเสนอเครื่องมือที่ใช้งานง่าย แหล่งข้อมูลการศึกษา และคุณลักษณะการซื้อขายขั้นสูงเพื่อช่วยให้คุณนำทางในตลาดคริปโตด้วยความมั่นใจ
Our Values,Nos valeurs,Onze waarden,Unsere Werte,Nuestros valores,Nossos Valores,Nasze wartości,قيمنا,I nostri valori,Nilai Kami,我们的价值观,ہماری اقدار,Nilai-nilai Kami,Giá trị của chúng tôi,คุณค่าของเรา
Security First,La sécurité avant tout,Veiligheid eerst,Sicherheit geht vor,La seguridad es lo primero,Segurança em primeiro lugar,Bezpieczeństwo przede wszystkim,الأمن أولاً,La sicurezza prima di tutto,Keselamatan Diutamakan,安全第一,سیکیورٹی پہلے,Keamanan Pertama,An ninh là trên hết,ความปลอดภัยเป็นสิ่งสำคัญที่สุด
