DOWNLOAD PAGE,,,,,,,,,,,,,,
Network fees are separate from platform fees and vary based on blockchain congestion.,Les frais de réseau sont distincts des frais de plateforme et varient en fonction de la congestion de la blockchain.,Netwerkkosten staan ​​los van platformkosten en variëren afhankelijk van de congestie van de blockchain.,Netzwerkgebühren sind von Plattformgebühren getrennt und variieren je nach Blockchain-Überlastung.,Las tarifas de red son independientes de las tarifas de la plataforma y varían según la congestión de la cadena de bloques.,As taxas de rede são separadas das taxas de plataforma e variam de acordo com o congestionamento do blockchain.,Opłaty sieciowe są niezależne od opłat platformowych i zmieniają się w zależności od obciążenia blockchaina.,رسوم الشبكة منفصلة عن رسوم المنصة وتختلف بناءً على ازدحام blockchain.,Le commissioni di rete sono separate dalle commissioni della piattaforma e variano in base alla congestione della blockchain.,Yuran rangkaian adalah berasingan daripada yuran platform dan berbeza-beza berdasarkan kesesakan rantaian blok.,网络费用与平台费用是分开的，并且根据区块链拥堵程度而有所不同。,نیٹ ورک کی فیس پلیٹ فارم فیس سے الگ ہوتی ہے اور بلاک چین کی بھیڑ کی بنیاد پر مختلف ہوتی ہے۔,Biaya jaringan terpisah dari biaya platform dan bervariasi berdasarkan kemacetan blockchain.,Phí mạng tách biệt với phí nền tảng và thay đổi tùy theo tình trạng tắc nghẽn của blockchain.,ค่าธรรมเนียมเครือข่ายจะแยกจากค่าธรรมเนียมแพลตฟอร์มและจะแตกต่างกันไปตามความแออัดของบล็อกเชน
Test with a small amount first if you're unsure about network compatibility.,Testez d’abord avec une petite quantité si vous n’êtes pas sûr de la compatibilité du réseau.,Test het eerst met een kleine hoeveelheid als u niet zeker bent van de netwerkcompatibiliteit.,"Wenn Sie sich hinsichtlich der Netzwerkkompatibilität nicht sicher sind, testen Sie zunächst mit einer kleinen Menge.",Pruebe primero con una pequeña cantidad si no está seguro acerca de la compatibilidad de la red.,Teste com uma pequena quantidade primeiro se não tiver certeza sobre a compatibilidade da rede.,"Jeśli nie masz pewności co do kompatybilności sieciowej, przetestuj ją najpierw na małej ilości.",قم بإجراء اختبار بكمية صغيرة أولاً إذا لم تكن متأكدًا من توافق الشبكة.,"Se non sei sicuro della compatibilità di rete, fai prima una prova con una piccola quantità.",Uji dengan jumlah yang kecil dahulu jika anda tidak pasti tentang keserasian rangkaian.,如果您不确定网络兼容性，请先进行少量测试。,اگر آپ کو نیٹ ورک کی مطابقت کے بارے میں یقین نہیں ہے تو پہلے تھوڑی رقم سے ٹیسٹ کریں۔,Uji terlebih dahulu dengan jumlah kecil jika Anda tidak yakin tentang kompatibilitas jaringan.,Hãy thử nghiệm với một lượng nhỏ trước nếu bạn không chắc chắn về khả năng tương thích của mạng.,ทดสอบด้วยปริมาณเล็กน้อยก่อนหากคุณไม่แน่ใจเกี่ยวกับความเข้ากันได้ของเครือข่าย
FAQ,FAQ,Veelgestelde vragen,Häufig gestellte Fragen,Preguntas frecuentes,Perguntas frequentes,Często zadawane pytania,التعليمات,Domande frequenti,Soalan Lazim,常问问题,اکثر پوچھے گئے سوالات,Tanya Jawab Umum,Câu hỏi thường gặp,คำถามที่พบบ่อย
Search FAQs...,Rechercher dans la FAQ...,Zoek in de FAQ...,FAQs durchsuchen...,Buscar preguntas frecuentes...,Pesquisar Perguntas Frequentes...,Wyszukaj FAQ...,البحث في الأسئلة الشائعة...,Cerca nelle FAQ...,Carian Soalan Lazim...,搜索常见问题解答...,اکثر پوچھے گئے سوالات تلاش کریں...,Cari FAQ...,Tìm kiếm Câu hỏi thường gặp...,ค้นหาคำถามที่พบบ่อย...
How do I make a withdrawal? Why have I still not received my withdrawal? How do I select the correct network for my crypto withdrawals and deposits? Do I need to pay fees for deposit and withdrawal?,Comment effectuer un retrait ? Pourquoi n'ai-je toujours pas reçu mon retrait ? Comment sélectionner le bon réseau pour mes retraits et dépôts de cryptomonnaies ? Dois-je payer des frais de dépôt et de retrait ?,Hoe kan ik geld opnemen? Waarom heb ik mijn opname nog steeds niet ontvangen? Hoe selecteer ik het juiste netwerk voor mijn crypto-opnames en -stortingen? Moet ik kosten betalen voor stortingen en opnames?,Wie nehme ich eine Auszahlung vor? Warum habe ich meine Auszahlung noch nicht erhalten? Wie wähle ich das richtige Netzwerk für meine Krypto-Auszahlungen und -Einzahlungen aus? Fallen für Ein- und Auszahlungen Gebühren an?,¿Cómo hago un retiro? ¿Por qué aún no he recibido mi retiro? ¿Cómo selecciono la red correcta para mis retiros y depósitos de criptomonedas? ¿Tengo que pagar comisiones por depósitos y retiros?,Como faço um saque? Por que ainda não recebi meu saque? Como seleciono a rede correta para meus saques e depósitos em criptomoedas? Preciso pagar taxas para depósito e saque?,Jak dokonać wypłaty? Dlaczego nadal nie otrzymałem wypłaty? Jak wybrać odpowiednią sieć do wypłat i wpłat kryptowalut? Czy muszę płacić opłaty za wpłaty i wypłaty?,كيف يمكنني السحب؟ لماذا لم أستلم المبلغ المسحوب بعد؟ كيف أختار الشبكة المناسبة لسحب وإيداع العملات المشفرة؟ هل أحتاج إلى دفع رسوم للإيداع والسحب؟,Come posso effettuare un prelievo? Perché non ho ancora ricevuto il mio prelievo? Come faccio a selezionare la rete corretta per i miei prelievi e depositi di criptovalute? Devo pagare commissioni per depositi e prelievi?,Bagaimanakah cara saya membuat pengeluaran? Mengapa saya masih belum menerima pengeluaran saya? Bagaimanakah cara saya memilih rangkaian yang betul untuk pengeluaran dan deposit crypto saya? Adakah saya perlu membayar yuran untuk deposit dan pengeluaran?,如何提现？为什么我到现在还没收到提现？如何选择正确的网络进行加密货币提现和存款？存款和提现需要支付手续费吗？,میں واپسی کیسے کروں؟ مجھے ابھی تک اپنی واپسی کیوں نہیں ملی؟ میں اپنے کرپٹو نکالنے اور جمع کرنے کے لیے صحیح نیٹ ورک کا انتخاب کیسے کروں؟ کیا مجھے جمع کرنے اور نکالنے کے لیے فیس ادا کرنے کی ضرورت ہے؟,Bagaimana cara saya melakukan penarikan? Mengapa saya masih belum menerima penarikan saya? Bagaimana cara memilih jaringan yang tepat untuk penarikan dan penyetoran kripto saya? Apakah saya perlu membayar biaya untuk penyetoran dan penarikan?,Tôi rút tiền như thế nào? Tại sao tôi vẫn chưa nhận được tiền rút? Làm thế nào để chọn đúng mạng lưới cho việc rút và gửi tiền điện tử của tôi? Tôi có cần phải trả phí gửi và rút tiền không?,ฉันจะถอนเงินได้อย่างไร ทำไมฉันถึงยังไม่ได้รับเงินที่ถอนออกมา ฉันจะเลือกเครือข่ายที่ถูกต้องสำหรับการถอนและฝากเงินคริปโตได้อย่างไร ฉันต้องจ่ายค่าธรรมเนียมในการฝากและถอนเงินหรือไม่
©2025 Kinecoin.co | All Rights Reserved,©2025 Kinecoin.co | Tous droits réservés,©2025 Kinecoin.co | Alle rechten voorbehouden,©2025 Kinecoin.co | Alle Rechte vorbehalten,©2025 Kinecoin.co | Todos los derechos reservados,©2025 Kinecoin.co | Todos os direitos reservados,©2025 Kinecoin.co | Wszelkie prawa zastrzeżone,©2025 Kinecoin.co | جميع الحقوق محفوظة,©2025 Kinecoin.co | Tutti i diritti riservati,©2025 Kinecoin.co | Hak Cipta Terpelihara,©2025 Kinecoin.co | 版权所有,©2025 Kinecoin.co | جملہ حقوق محفوظ ہیں۔,©2025 Kinecoin.co | Hak Cipta Dilindungi Undang-Undang,©2025 Kinecoin.co | Mọi quyền được bảo lưu,©2025 Kinecoin.co | สงวนลิขสิทธิ์
More about KINE,En savoir plus sur KINE,Meer over KINE,Mehr zu KINE,Más sobre KINE,Mais sobre KINE,Więcej o KINE,المزيد عن KINE,Maggiori informazioni su KINE,Lebih lanjut mengenai KINE,关于 KINE 的更多信息,KINE کے بارے میں مزید,Lebih lanjut tentang KINE,Tìm hiểu thêm về KINE,ข้อมูลเพิ่มเติมเกี่ยวกับ KINE
About us,À propos de nous,Over ons,Über uns,Sobre nosotros,Sobre nós,O nas,معلومات عنا,Chi siamo,Tentang kami,关于我们,ہمارے بارے میں,Tentang kami,Về chúng tôi,เกี่ยวกับเรา
Terms of Use,Conditions d'utilisation,Gebruiksvoorwaarden,Nutzungsbedingungen,Condiciones de uso,Termos de Uso,Warunki korzystania,شروط الاستخدام,Termini di utilizzo,Syarat Penggunaan,使用条款,استعمال کی شرائط,Ketentuan Penggunaan,Điều khoản sử dụng,เงื่อนไขการใช้งาน
Privacy and Cookie Policy,Politique de confidentialité et de cookies,Privacy- en cookiebeleid,Datenschutz- und Cookie-Richtlinien,Política de privacidad y cookies,Política de Privacidade e Cookies,Polityka prywatności i plików cookie,سياسة الخصوصية وملفات تعريف الارتباط,Informativa sulla privacy e sui cookie,Dasar Privasi dan Kuki,隐私和 Cookie 政策,رازداری اور کوکی پالیسی,Kebijakan Privasi dan Cookie,Chính sách bảo mật và cookie,นโยบายความเป็นส่วนตัวและคุกกี้
Download App,Télécharger l'application,App downloaden,App herunterladen,Descargar la aplicación,Baixar aplicativo,Pobierz aplikację,تنزيل التطبيق,Scarica l'app,Muat turun Apl,下载应用程序,ایپ ڈاؤن لوڈ کریں۔,Unduh Aplikasi,Tải ứng dụng,ดาวน์โหลดแอป
Products,Produits,Producten,Produkte,Productos,Produtos,Produkty,منتجات,Prodotti,Produk,产品,مصنوعات,Produk,Các sản phẩm,สินค้า
Spot Trading,Négociation au comptant,Spothandel,Spothandel,Comercio al contado,Negociação à vista,Handel spotowy,التداول الفوري,Negoziazione spot,Dagangan Spot,现货交易,سپاٹ ٹریڈنگ,Perdagangan Spot,Giao dịch giao ngay,การซื้อขายแบบสปอต
Futures Trading,Négociation à terme,Futureshandel,Futures-Handel,Comercio de futuros,Negociação de Futuros,Handel kontraktami terminowymi,تداول العقود الآجلة,Negoziazione di futures,Dagangan Niaga Hadapan,期货交易,فیوچر ٹریڈنگ,Perdagangan Berjangka,Giao dịch tương lai,การซื้อขายล่วงหน้า
Conversion,Conversion,Conversie,Konvertierung,Conversión,Conversão,Konwersja,تحويل,Conversione,Penukaran,转换,تبدیلی,Konversi,Chuyển đổi,การแปลง
Earn,Gagner,Verdienen,Verdienen,Ganar,Ganhar,Zarabiać,يكسب,Guadagnare,Dapatkan,赚,کمائیں,Menghasilkan,Kiếm,ได้รับ
Markets,Marchés,Markten,Märkte,Mercados,Mercados,Rynki,الأسواق,Mercati,Pasaran,市场,منڈیاں,Pasar,Thị trường,ตลาด
Market Overview,Aperçu du marché,Marktoverzicht,Marktübersicht,Descripción general del mercado,Visão geral do mercado,Przegląd rynku,نظرة عامة على السوق,Panoramica del mercato,Tinjauan Pasaran,市场概览,مارکیٹ کا جائزہ,Gambaran Umum Pasar,Tổng quan thị trường,ภาพรวมตลาด
Assets,Actifs,Activa,Vermögenswerte,Activos,Ativos,Aktywa,أصول,Attività,Aset,资产,اثاثے,Aktiva,Tài sản,สินทรัพย์
Account,Compte,Rekening,Konto,Cuenta,Conta,Konto,حساب,Account,Akaun,帐户,اکاؤنٹ,Akun,Tài khoản,บัญชี
Sign Up,S'inscrire,Aanmelden,Melden Sie sich an,Inscribirse,Inscrever-se,Zapisać się,اشتراك,Iscrizione,Daftar,报名,سائن اپ کریں۔,Mendaftar,Đăng ký,สมัครสมาชิก
Login,Se connecter,Login,Login,Acceso,Conecte-se,Login,تسجيل الدخول,Login,Log masuk,登录,لاگ ان,Login,Đăng nhập,เข้าสู่ระบบ
Resources,Ressources,Bronnen,Ressourcen,Recursos,Recursos,Zasoby,موارد,Risorse,Sumber,资源,وسائل,Sumber daya,Tài nguyên,ทรัพยากร
About Us,À propos de nous,Over ons,Über uns,Sobre nosotros,Sobre nós,O nas,معلومات عنا,Chi siamo,Tentang Kami,关于我们,ہمارے بارے میں,Tentang Kami,Giới thiệu về chúng tôi,เกี่ยวกับเรา
Download App,Télécharger l'application,App downloaden,App herunterladen,Descargar la aplicación,Baixar aplicativo,Pobierz aplikację,تنزيل التطبيق,Scarica l'app,Muat turun Apl,下载应用程序,ایپ ڈاؤن لوڈ کریں۔,Unduh Aplikasi,Tải ứng dụng,ดาวน์โหลดแอป
Trade,Commerce,Handel,Handel,Comercio,Troca,Handel,تجارة,Commercio,Berdagang,贸易,تجارت,Berdagang,Buôn bán,ซื้อขาย
Spot Trading,Négociation au comptant,Spothandel,Spothandel,Comercio al contado,Negociação à vista,Handel spotowy,التداول الفوري,Negoziazione spot,Dagangan Spot,现货交易,سپاٹ ٹریڈنگ,Perdagangan Spot,Giao dịch giao ngay,การซื้อขายแบบสปอต
Futures Trading,Négociation à terme,Futureshandel,Futures-Handel,Comercio de futuros,Negociação de Futuros,Handel kontraktami terminowymi,تداول العقود الآجلة,Negoziazione di futures,Dagangan Niaga Hadapan,期货交易,فیوچر ٹریڈنگ,Perdagangan Berjangka,Giao dịch tương lai,การซื้อขายล่วงหน้า
Trade on the go with,Tradez en déplacement avec,Handel onderweg met,Handeln Sie unterwegs mit,Opere sobre la marcha con,Negocie em qualquer lugar com,Handluj w podróży dzięki,التجارة أثناء التنقل مع,Fai trading in mobilità con,Berdagang semasa dalam perjalanan dengan,随时随地进行交易,کے ساتھ چلتے پھرتے تجارت کریں۔,Berdagang saat bepergian dengan,Giao dịch khi đang di chuyển với,ซื้อขายได้ทุกที่ด้วย
KINE,KINE,STROOM,FLUSS,FLUJO,FLUXO,STRUMIEŃ,تدفق,FLUSSO,FLUKS,通量,فلکس,ALIRAN,TUÔN RA,ฟลักซ์
Trade Now,Échangez maintenant,Handel nu,Jetzt handeln,Opere ahora,Negocie agora,Handluj teraz,تداول الآن,Fai trading ora,Berdagang Sekarang,立即交易,ابھی تجارت کریں۔,Berdagang Sekarang,Giao dịch ngay,ซื้อขายทันที
,,,,,,,,,,,,,,
,,,,,,,,,,,,,,
WITHDRAWAL FAQ (Do I need to pay fees for deposit and withdrawal?) PAGE,,,,,,,,,,,,,,
Support Center,Centre d'assistance,Ondersteuningscentrum,Unterstützung,Centro de soporte,Centro de Suporte,Centrum wsparcia,مركز الدعم,Centro di supporto,Pusat Sokongan,支持中心,سپورٹ سینٹر,Pusat Dukungan,Trung tâm hỗ trợ,ศูนย์ช่วยเหลือ
FAQ,FAQ,Veelgestelde vragen,Häufig gestellte Fragen,Preguntas frecuentes,Perguntas frequentes,Często zadawane pytania,التعليمات,Domande frequenti,Soalan Lazim,常问问题,اکثر پوچھے گئے سوالات,Tanya Jawab Umum,Câu hỏi thường gặp,คำถามที่พบบ่อย
Deposit & Withdrawal,Dépôt et retrait,Storting en opname,Einzahlung & Auszahlung,Depósito y retiro,Depósito e retirada,Wpłata i wypłata,الإيداع والسحب,Deposito e prelievo,Deposit & Pengeluaran,存款和取款,جمع اور واپسی,Deposit & Penarikan,Gửi tiền và rút tiền,การฝากและถอนเงิน
Crypto Withdrawal,Retrait de crypto-monnaies,Crypto-opname,Krypto-Auszahlung,Retiro de criptomonedas,Retirada de Criptomoedas,Wypłata kryptowalut,سحب العملات المشفرة,Prelievo di criptovalute,Pengeluaran Kripto,加密货币提现,کرپٹو واپسی,Penarikan Kripto,Rút tiền mã hóa,การถอนเงินคริปโต
Getting Started,Commencer,Aan de slag,Erste Schritte,Empezando,Começando,Pierwsze kroki,ابدء,Iniziare,Bermula,入门,شروع کرنا,Memulai,Bắt đầu,การเริ่มต้น
Beginner,Débutant,Beginner,Anfänger,Principiante,Novato,Początkujący,مبتدئ,Principiante,pemula,初学者,مبتدی,Pemula,Người mới bắt đầu,ผู้เริ่มต้น
How do I make a withdrawal?,Comment puis-je effectuer un retrait ?,Hoe kan ik geld opnemen?,Wie nehme ich eine Auszahlung vor?,¿Cómo hago un retiro?,Como faço um saque?,Jak dokonać wypłaty?,كيف أقوم بالسحب؟,Come posso effettuare un prelievo?,Bagaimanakah cara saya membuat pengeluaran?,我如何提款？,میں واپسی کیسے کروں؟,Bagaimana cara saya melakukan penarikan?,Tôi có thể rút tiền bằng cách nào?,ฉันจะถอนเงินได้อย่างไร?
views,vues,uitzichten,Ansichten,puntos de vista,visualizações,widoki,وجهات النظر,visualizzazioni,pandangan,视图,مناظر,pandangan,lượt xem,มุมมอง
min read,min de lecture,min leestijd,min Lesezeit,lectura mínima,leitura mínima,min czytania,دقيقة قراءة,minuti di lettura,min baca,分钟阅读,منٹ پڑھیں,waktu baca min,phút đọc,อ่านนาที
"Updated Apr 15, 2024",Mis à jour le 15 avril 2024,Bijgewerkt op 15 april 2024,Aktualisiert 15. April 2024,Actualizado el 15 de abril de 2024,Atualizado em 15 de abril de 2024,Zaktualizowano 15 kwietnia 2024 r.,تم التحديث في 15 أبريل 2024,Aggiornato il 15 aprile 2024,Dikemas kini 15 Apr 2024,更新于 2024 年 4 月 15 日,15 اپریل 2024 کو اپ ڈیٹ ہوا۔,Diperbarui 15 April 2024,Cập nhật ngày 15 tháng 4 năm 2024,ปรับปรุงเมื่อ 15 เมษายน 2024
Getting Started with Withdrawals,Premiers pas avec les retraits,Aan de slag met opnames,Erste Schritte mit Abhebungen,Primeros pasos con los retiros,Introdução às retiradas,Rozpoczęcie wypłat,البدء في عمليات السحب,Come iniziare con i prelievi,Bermula dengan Pengeluaran,提款入门,واپسی کے ساتھ شروع کرنا,Memulai Penarikan,Bắt đầu với Rút tiền,การเริ่มต้นการถอนเงิน
"Log in to your account at Kinecoin.co, go to the Assets, and select Withdrawal.","Connectez-vous à votre compte sur Kinecoin.co, accédez aux actifs et sélectionnez Retrait.","Meld u aan bij uw account op Kinecoin.co, ga naar Activa en selecteer Opnemen.","Melden Sie sich bei Ihrem Konto bei Kinecoin.co an, gehen Sie zu „Assets“ und wählen Sie „Auszahlung“ aus.","Inicie sesión en su cuenta en Kinecoin.co, vaya a Activos y seleccione Retiro.","Entre na sua conta em Kinecoin.co, vá para Ativos e selecione Saque.","Zaloguj się na swoje konto na Kinecoin.co, przejdź do zakładki Aktywa i wybierz Wypłata.",قم بتسجيل الدخول إلى حسابك على Kinecoin.co، وانتقل إلى الأصول، وحدد السحب.,"Accedi al tuo account su Kinecoin.co, vai su Risorse e seleziona Prelievo.","Log masuk ke akaun anda di Kinecoin.co, pergi ke Aset, dan pilih Pengeluaran.",登录 Kinecoin.co 上的帐户，转到“资产”，然后选择“提款”。,Kinecoin.co پر اپنے اکاؤنٹ میں لاگ ان کریں، اثاثوں پر جائیں، اور واپسی کو منتخب کریں۔,"Masuk ke akun Anda di Kinecoin.co, buka Aset, dan pilih Penarikan.","Đăng nhập vào tài khoản của bạn tại Kinecoin.co, vào mục Tài sản và chọn Rút tiền.",เข้าสู่ระบบบัญชีของคุณที่ Kinecoin.co ไปที่สินทรัพย์ และเลือกถอนเงิน
"In the Select crypto dropdown, choose the cryptocurrency you want to withdraw.","Dans la liste déroulante Sélectionner la cryptomonnaie, choisissez la cryptomonnaie que vous souhaitez retirer.",Selecteer in het dropdownmenu 'Selecteer crypto' de cryptocurrency die u wilt opnemen.,"Wählen Sie im Dropdown-Menü „Krypto auswählen“ die Kryptowährung aus, die Sie abheben möchten.","En el menú desplegable Seleccionar criptomoneda, elija la criptomoneda que desea retirar.","No menu suspenso Selecionar criptomoeda, escolha a criptomoeda que você deseja sacar.","Z listy rozwijanej Wybierz kryptowalutę wybierz kryptowalutę, którą chcesz wypłacić.","في القائمة المنسدلة ""تحديد العملة المشفرة""، اختر العملة المشفرة التي تريد سحبها.","Nel menu a discesa Seleziona criptovaluta, scegli la criptovaluta che desideri prelevare.","Dalam menu lungsur Pilih crypto, pilih mata wang kripto yang anda ingin keluarkan.",在选择加密货币下拉菜单中，选择您想要提取的加密货币。,سلیکٹ کریپٹو ڈراپ ڈاؤن میں، وہ کریپٹو کرنسی منتخب کریں جسے آپ واپس لینا چاہتے ہیں۔,"Pada menu tarik-turun Pilih kripto, pilih mata uang kripto yang ingin Anda tarik.","Trong danh sách thả xuống Chọn tiền điện tử, hãy chọn loại tiền điện tử bạn muốn rút.",ในเมนูแบบดรอปดาวน์ เลือกสกุลเงินดิจิทัล ให้เลือกสกุลเงินดิจิทัลที่คุณต้องการถอนออก
Network fees vary by blockchain and current congestion levels.,Les frais de réseau varient en fonction de la blockchain et des niveaux de congestion actuels.,Netwerkkosten variëren per blockchain en per huidige mate van congestie.,Die Netzwerkgebühren variieren je nach Blockchain und aktuellem Überlastungsgrad.,Las tarifas de red varían según la cadena de bloques y los niveles de congestión actuales.,As taxas de rede variam de acordo com o blockchain e os níveis de congestionamento atuais.,Opłaty sieciowe różnią się w zależności od blockchaina i aktualnego poziomu przeciążenia.,تختلف رسوم الشبكة حسب blockchain ومستويات الازدحام الحالية.,Le tariffe di rete variano in base alla blockchain e agli attuali livelli di congestione.,Yuran rangkaian berbeza-beza mengikut rantaian blok dan tahap kesesakan semasa.,网络费用因区块链和当前拥堵程度而异。,نیٹ ورک کی فیس بلاکچین اور موجودہ بھیڑ کی سطح کے لحاظ سے مختلف ہوتی ہے۔,Biaya jaringan bervariasi berdasarkan blockchain dan tingkat kemacetan saat ini.,Phí mạng thay đổi tùy theo blockchain và mức độ tắc nghẽn hiện tại.,ค่าธรรมเนียมเครือข่ายแตกต่างกันไปขึ้นอยู่กับบล็อคเชนและระดับความแออัดในปัจจุบัน
Steps to Track Your Withdrawal,Étapes pour suivre votre retrait,Stappen om uw opname bij te houden,Schritte zur Verfolgung Ihrer Auszahlung,Pasos para realizar el seguimiento de su retiro,Etapas para rastrear sua retirada,Kroki śledzenia wypłaty,خطوات لتتبع عملية السحب الخاصة بك,Passaggi per monitorare il tuo prelievo,Langkah-langkah untuk Menjejaki Pengeluaran Anda,追踪提款步骤,آپ کی واپسی کو ٹریک کرنے کے اقدامات,Langkah-Langkah untuk Melacak Penarikan Anda,Các bước theo dõi việc rút tiền của bạn,ขั้นตอนการติดตามการถอนเงินของคุณ
